{
  "id": "rules_section:example:class-features-sable-knight",
  "type": "rules_section",
  "name": "Class Features (Sable Knight)",
  "slug": "class-features-sable-knight",
  "aliases": [],
  "book_id": "example",
  "pages": [1],
  "citation": "Example p. 1",
  "text_md": "All of the following are class features of the sable knight prestige class.\n\nA sable knight gains no proficiency with any weapon or armor beyond what she already possesses. At 3rd level, and every three levels thereafter, a sable knight may perform the Rite of the Black Oath, gaining a +1 profane bonus on Intimidate checks that stacks with itself.",
  "fields": {
    "topic": "Class Features",
    "parent_section": "Sable Knight",
    "chapter": "Chapter 1: The Sable Order"
  },
  "tables": ["table:example:table-1-1-sable-ranks"],
  "canonical": false,
  "variant_of": null,
  "applied_overrides": [],
  "macro_eligible": false,
  "schema_version": 1,
  "extraction": {
    "tier": "haiku",
    "model": "claude-haiku-4-5",
    "segment_id": "example-p0001-03",
    "timestamp": "2026-01-01T00:00:00+00:00"
  }
}
